Professor,Courses
Angela Marie Eaton,"ADMN-1010, WRIT-4120"
Jeannie Steigler,"ADMN-1010, ADMN-1961, ADMN-1962, GENL-4045, MGMT-6963, MGMT-6965, MGMT-6966, WRIT-2340, WRIT-2960"
Jeffrey Allen Englert,"USAF-0010, USAF-0020, USAF-0030, USAF-0040, USAF-0060, USAF-0080, USAF-2070, USAF-2080"
Peter Hall,USAF-1020
Michael A. Szymczak,"USAF-2040, USAF-2940"
Tisha Lea Spraggins,"USAF-2060, USAF-4940"
TBA,"ADMN-1010, ADMN-1962, ADMN-4020, ADMN-4400, ADMN-6150, ADMN-6400, ADMN-6600, ADMN-6800, ARCH-1961, ARCH-1974, ARCH-2001, ARCH-2130, ARCH-2200, ARCH-2210, ARCH-2220, ARCH-2230, ARCH-2240, ARCH-2320, ARCH-2330, ARCH-2360, ARCH-2600, ARCH-2610, ARCH-2620, ARCH-2630, ARCH-2810, ARCH-2820, ARCH-2850, ARCH-2961, ARCH-4050, ARCH-4120, ARCH-4140, ARCH-4150, ARCH-4200, ARCH-4240, ARCH-4250, ARCH-4260, ARCH-4270, ARCH-4300, ARCH-4360, ARCH-4430, ARCH-4540, ARCH-4550, ARCH-4700, ARCH-4760, ARCH-4770, ARCH-4780, ARCH-4790, ARCH-4830, ARCH-4840, ARCH-4850, ARCH-4940, ARCH-4960, ARCH-4963, ARCH-4965, ARCH-4966, ARCH-4980, ARCH-4990, ARCH-5100, ARCH-5200, ARCH-5210, ARCH-5390, ARCH-6120, ARCH-6130, ARCH-6330, ARCH-6400, ARCH-6420, ARCH-6640, ARCH-6900, ARCH-6910, ARCH-6940, ARCH-6961, ARCH-6962, ARCH-6963, ARCH-6964, ARCH-6968, ARCH-6980, ARCH-6990, ARCH-9990, ARTS-1001, ARTS-1010, ARTS-1020, ARTS-1030, ARTS-1962, ARTS-2530, ARTS-2750, ARTS-2961, ARTS-2964, ARTS-2965, ARTS-2966, ARTS-4004, ARTS-4130, ARTS-4940, ARTS-4962, ARTS-6260, ARTS-6900, ARTS-6961, ARTS-6962, ARTS-6990, ASTR-1510, ASTR-1530, ASTR-1960, ASTR-2050, ASTR-2120, ASTR-4220, ASTR-4510, ASTR-6960, ASTR-9990, BCBP-2900, BCBP-2990, BCBP-4002, BCBP-4710, BCBP-4760, BCBP-4770, BCBP-4961, BCBP-4967, BCBP-4968, BCBP-4969, BCBP-4990, BCBP-6961, BCBP-6967, BCBP-6968, BCBP-6990, BIOL-1010, BIOL-1040, BIOL-2120, BIOL-2310, BIOL-2500, BIOL-2900, BIOL-2930, BIOL-2940, BIOL-2990, BIOL-4002, BIOL-4004, BIOL-4009, BIOL-4020, BIOL-4270, BIOL-4280, BIOL-4290, BIOL-4320, BIOL-4620, BIOL-4710, BIOL-4720, BIOL-4740, BIOL-4760, BIOL-4770, BIOL-4940, BIOL-4961, BIOL-4963, BIOL-4965, BIOL-4967, BIOL-4968, BIOL-4969, BIOL-6310, BIOL-6690, BIOL-6940, BIOL-6961, BIOL-6963, BIOL-6967, BIOL-6968, BIOL-6969, BIOL-6990, BIOL-9990, BMED-1340, BMED-4010, BMED-4110, BMED-4420, BMED-4500, BMED-4600, BMED-4961, BMED-4964, BMED-4969, BMED-6280, BMED-6420, BMED-6800, BMED-6964, BMED-6968, BMED-6970, BMED-6980, BMED-6990, BMED-9990, BUSN-6500, BUSN-6501, CHEM-1100, CHEM-1110, CHEM-1120, CHEM-1200, CHEM-1210, CHEM-1220, CHEM-1300, CHEM-1500, CHEM-1600, CHEM-1960, CHEM-2120, CHEM-2150, CHEM-2210, CHEM-2220, CHEM-2230, CHEM-2240, CHEM-2250, CHEM-2260, CHEM-2270, CHEM-2290, CHEM-2930, CHEM-2940, CHEM-2950, CHEM-4060, CHEM-4150, CHEM-4190, CHEM-4310, CHEM-4330, CHEM-4460, CHEM-4530, CHEM-4640, CHEM-4760, CHEM-4770, CHEM-4940, CHEM-4950, CHEM-4961, CHEM-4962, CHEM-4963, CHEM-4964, CHEM-4970, CHEM-4990, CHEM-6002, CHEM-6010, CHEM-6310, CHEM-6620, CHEM-6640, CHEM-6760, CHEM-6940, CHEM-6963, CHEM-6964, CHEM-6965, CHEM-6966, CHEM-6990, CHEM-9990, CHME-1960, CHME-2020, CHME-2940, CHME-2980, CHME-4150, CHME-4170, CHME-4500, CHME-4940, CHME-4961, CHME-4962, CHME-4965, CHME-4966, CHME-6640, CHME-6940, CHME-6961, CHME-6962, CHME-6963, CHME-6966, CHME-6970, CHME-6990, CHME-9990, CIVL-2050, CIVL-2060, CIVL-2630, CIVL-2670, CIVL-2940, CIVL-4010, CIVL-4120, CIVL-4150, CIVL-4940, CIVL-4961, CIVL-4962, CIVL-6940, CIVL-6961, CIVL-6980, CIVL-6990, CIVL-9990, COGS-4990, COGS-6570, COGS-6961, COMM-1510, COMM-2950, COMM-4300, COMM-4580, COMM-4690, COMM-4962, COMM-4963, COMM-4965, COMM-4967, COMM-4969, COMM-6260, COMM-6540, COMM-6710, COMM-6940, COMM-6962, COMM-6990, COMM-9990, CSCI-1010, CSCI-1100, CSCI-1190, CSCI-1200, CSCI-1961, CSCI-2005, CSCI-2200, CSCI-2300, CSCI-2400, CSCI-2500, CSCI-2600, CSCI-2800, CSCI-2940, CSCI-2960, CSCI-2965, CSCI-4100, CSCI-4150, CSCI-4210, CSCI-4380, CSCI-4430, CSCI-4460, CSCI-4600, CSCI-4800, CSCI-4961, CSCI-4962, CSCI-4963, CSCI-4966, CSCI-4967, CSCI-4970, CSCI-4977, CSCI-6100, CSCI-6460, CSCI-6900, CSCI-6940, CSCI-6962, CSCI-6964, CSCI-6967, CSCI-6968, CSCI-6969, CSCI-6970, CSCI-6980, CSCI-6990, CSCI-9990, DSES-4530, DSES-4640, DSES-4650, DSES-4750, DSES-6002, DSES-6110, DSES-6470, DSES-6970, DSES-6980, DSES-9990, ECON-1200, ECON-2010, ECON-2020, ECON-4570, ECON-4900, ECON-4940, ECON-4962, ECON-6002, ECON-6140, ECON-6570, ECON-6940, ECON-6960, ECON-6961, ECON-6990, ECON-9990, ECSE-2010, ECSE-2050, ECSE-2060, ECSE-2100, ECSE-2110, ECSE-2210, ECSE-2410, ECSE-2610, ECSE-2660, ECSE-2960, ECSE-4040, ECSE-4130, ECSE-4440, ECSE-4470, ECSE-4480, ECSE-4500, ECSE-4510, ECSE-4640, ECSE-4720, ECSE-4750, ECSE-4760, ECSE-4770, ECSE-4780, ECSE-4790, ECSE-4960, ECSE-4964, ECSE-4965, ECSE-4980, ECSE-6200, ECSE-6300, ECSE-6400, ECSE-6460, ECSE-6470, ECSE-6530, ECSE-6700, ECSE-6770, ECSE-6780, ECSE-6840, ECSE-6900, ECSE-6960, ECSE-6961, ECSE-6964, ECSE-6965, ECSE-6970, ECSE-6980, ECSE-6990, ECSE-9990, EMBA-6961, ENGR-1100, ENGR-1310, ENGR-1500, ENGR-1600, ENGR-1961, ENGR-1962, ENGR-2010, ENGR-2050, ENGR-2090, ENGR-2250, ENGR-2300, ENGR-2350, ENGR-2530, ENGR-2600, ENGR-2720, ENGR-2961, ENGR-2963, ENGR-4050, ENGR-4300, ENGR-4710, ENGR-4720, ENGR-4961, ENGR-6970, ENVE-4150, ENVE-4160, ENVE-4310, ENVE-4320, ENVE-4350, ENVE-4370, ENVE-4470, ENVE-4560, ENVE-6002, ENVE-6200, ENVE-6220, ENVE-6940, ENVE-6980, ENVE-6990, ENVE-9990, EPOW-2950, EPOW-4010, EPOW-4030, EPOW-4940, EPOW-4980, EPOW-6890, EPOW-6940, EPOW-6980, EPOW-6990, EPOW-9990, ERTH-1010, ERTH-1020, ERTH-1030, ERTH-1100, ERTH-1200, ERTH-2120, ERTH-2210, ERTH-2330, ERTH-4070, ERTH-4190, ERTH-4200, ERTH-4340, ERTH-4560, ERTH-4810, ERTH-4961, ERTH-4970, ERTH-4980, ERTH-6200, ERTH-6300, ERTH-6963, ERTH-6980, ERTH-6990, ERTH-9990, ESCI-2950, ESCI-9990, GSAS-4960, GSAS-6980, IHSS-1140, IHSS-1210, IHSS-1220, IHSS-1240, IHSS-1960, IHSS-1961, IHSS-1962, IHSS-1963, IHSS-1964, IHSS-1965, IHSS-1966, IHSS-1967, IHSS-1968, IHSS-1969, IHSS-1970, IHSS-2960, IHSS-4940, ILEA-4400, INQR-1220, ISCI-1600, ISCI-4510, ISCI-4950, ISCI-6510, ISCI-6965, ISCI-9990, ISYE-4961, ISYE-6961, ISYE-6980, ISYE-6990, ISYE-9990, ITEC-1210, ITEC-1220, ITEC-1961, ITEC-2110, ITEC-2961, ITEC-4962, ITEC-6980, ITWS-1100, ITWS-1220, ITWS-2110, ITWS-2940, ITWS-2961, ITWS-4980, ITWS-4990, ITWS-6990, LANG-1001, LANG-1009, LANG-1610, LANG-2001, LANG-2002, LANG-2009, LANG-2940, LANG-2950, LANG-4002, LANG-4009, LANG-4940, LANG-6940, LGHT-4790, LGHT-6760, LGHT-6940, LGHT-6980, LGHT-6990, LITR-2003, LITR-2420, LITR-2450, LITR-2940, LITR-2950, LITR-4009, LITR-4410, LITR-4940, LITR-6940, MANE-1960, MANE-1961, MANE-2110, MANE-2400, MANE-2960, MANE-4010, MANE-4020, MANE-4050, MANE-4120, MANE-4180, MANE-4260, MANE-4360, MANE-4380, MANE-4400, MANE-4470, MANE-4530, MANE-4560, MANE-4740, MANE-4940, MANE-4962, MANE-4964, MANE-4965, MANE-5000, MANE-6120, MANE-6270, MANE-6942, MANE-6961, MANE-6965, MANE-6980, MANE-6990, MANE-9990, MATH-1009, MATH-1010, MATH-1020, MATH-1500, MATH-1520, MATH-1620, MATH-2001, MATH-2010, MATH-2400, MATH-2800, MATH-2950, MATH-2961, MATH-2965, MATH-4002, MATH-4020, MATH-4090, MATH-4200, MATH-4300, MATH-4800, MATH-4940, MATH-4950, MATH-4960, MATH-4980, MATH-6490, MATH-6792, MATH-6940, MATH-6950, MATH-6980, MATH-6990, MATH-9990, MATP-2950, MATP-4400, MATP-4600, MATP-4910, MATP-4980, MATP-6910, MATP-6980, MATP-6990, MGMT-1100, MGMT-1260, MGMT-2100, MGMT-2510, MGMT-2950, MGMT-4002, MGMT-4005, MGMT-4110, MGMT-4140, MGMT-4310, MGMT-4350, MGMT-4370, MGMT-4380, MGMT-4430, MGMT-4440, MGMT-4450, MGMT-4530, MGMT-4540, MGMT-4900, MGMT-4940, MGMT-4961, MGMT-4962, MGMT-4967, MGMT-6002, MGMT-6005, MGMT-6020, MGMT-6140, MGMT-6170, MGMT-6300, MGMT-6470, MGMT-6490, MGMT-6660, MGMT-6680, MGMT-6710, MGMT-6720, MGMT-6840, MGMT-6940, MGMT-6966, MGMT-6990, MGMT-7760, MGMT-9990, MTLE-2940, MTLE-2950, MTLE-4250, MTLE-4400, MTLE-4450, MTLE-4500, MTLE-4630, MTLE-4850, MTLE-4920, MTLE-4940, MTLE-4960, MTLE-4961, MTLE-4962, MTLE-6120, MTLE-6250, MTLE-6300, MTLE-6940, MTLE-6960, MTLE-6962, MTLE-6964, MTLE-6980, MTLE-6990, MTLE-9990, PHIL-1960, PHIL-2600, PHIL-2940, PHIL-2961, PHIL-4240, PHIL-4260, PHIL-4300, PHIL-4960, PHIL-4990, PHIL-6940, PHIL-6990, PHYS-1100, PHYS-1110, PHYS-1150, PHYS-1200, PHYS-1250, PHYS-1600, PHYS-1960, PHYS-1961, PHYS-2100, PHYS-2350, PHYS-2370, PHYS-2620, PHYS-2940, PHYS-2950, PHYS-4210, PHYS-4510, PHYS-4640, PHYS-4940, PHYS-4962, PHYS-6410, PHYS-6510, PHYS-6520, PHYS-6530, PHYS-6590, PHYS-6900, PHYS-6940, PHYS-6980, PHYS-6990, PHYS-9990, PSYC-2002, PSYC-2009, PSYC-2220, PSYC-2730, PSYC-2950, PSYC-4002, PSYC-4003, PSYC-4370, PSYC-4500, PSYC-4740, PSYC-4940, PSYC-4943, PSYC-4961, PSYC-4967, PSYC-4990, PSYC-6990, STSH-1110, STSH-2001, STSH-2002, STSH-2940, STSH-2961, STSH-4003, STSH-4004, STSH-4009, STSH-4340, STSH-4940, STSH-4961, STSH-4980, STSH-6940, STSS-1003, STSS-1110, STSS-1510, STSS-2940, STSS-2950, STSS-2961, STSS-4002, STSS-4280, STSS-4840, STSS-4940, STSS-4961, STSS-4962, STSS-4963, STSS-4964, STSS-4965, STSS-4969, STSS-4980, STSS-6940, STSS-6970, STSS-6990, STSS-9990, USAF-2940, USAR-2940, USAR-4010, USAR-4020, WRIT-1110, WRIT-2110, WRIT-2360, WRIT-2940, WRIT-2950, WRIT-2960, WRIT-2961, WRIT-4940, WRIT-6940"
David H Bell,"ARCH-1940, ARCH-2110, ARCH-2120, ARCH-2130, ARCH-2140, ARCH-2150, ARCH-2220, ARCH-2230, ARCH-2240, ARCH-2620, ARCH-2630, ARCH-2820, ARCH-2830, ARCH-2940, ARCH-4100, ARCH-4110, ARCH-4120, ARCH-4240, ARCH-4250, ARCH-4260, ARCH-4270, ARCH-4360, ARCH-4770, ARCH-4780, ARCH-4940, ARCH-4941, ARCH-4964, ARCH-4965, ARCH-4966, ARCH-4968, ARCH-4970, ARCH-4972, ARCH-4973, ARCH-4974, ARCH-4975, ARCH-4976, ARCH-4980, ARCH-4990, ARCH-5100, ARCH-5110, ARCH-5200, ARCH-5210, ARCH-6120, ARCH-6130, ARCH-6980, ARCH-6990"
Frances Bronet,"ARCH-1961, ARCH-2200, ARCH-2210, ARCH-2220, ARCH-2230, ARCH-2240, ARCH-2510, ARCH-2600, ARCH-2940, ARCH-2961, ARCH-4250, ARCH-4260, ARCH-4270, ARCH-4940, ARCH-4964, ARCH-4966, ARCH-4980, ARCH-4990, ARCH-6940, ARCH-6990"
Stephanie M Bayard,"ARCH-2220, ARCH-4963, ARCH-4967"
Douglas V Diaz,ARCH-2240
Walter M. Kroner,"ARCH-2340, ARCH-2360, ARCH-2940, ARCH-4510, ARCH-4810, ARCH-4940, ARCH-4980, ARCH-4990, ARCH-6810, ARCH-6900, ARCH-6940, ARCH-6990"
David S Haviland,"ARCH-2940, ARCH-4540"
Dennis Tanczos,"ARCH-2320, ARCH-2940, ARCH-4700, ARCH-4940, ARCH-4980, ARCH-4990, ARCH-6990"
Peter W Parsons,"ARCH-2220, ARCH-2240, ARCH-2620, ARCH-4030, ARCH-4140, ARCH-4240, ARCH-4250, ARCH-4260, ARCH-4270, ARCH-4300, ARCH-4360, ARCH-4940, ARCH-4961, ARCH-4980, ARCH-4990, ARCH-6110, ARCH-6900, ARCH-6940, ARCH-6990, BIOL-4940"
Brian Lonsway,"ARCH-4250, ARCH-4260, ARCH-4270, ARCH-4460, ARCH-4940, ARCH-4961, ARCH-4966, ARCH-4980, ARCH-4990, ARCH-6400, ARCH-6420, ARCH-6810, ARCH-6900, ARCH-6940, ARCH-6980, ARCH-6990, ARCH-9990, CSCI-4940"
Mark Steven Mistur,"ARCH-1961, ARCH-2220, ARCH-2510, ARCH-2940, ARCH-4300, ARCH-4510, ARCH-4690, ARCH-4940, ARCH-4961, ARCH-4962, ARCH-4966, ARCH-4972, ARCH-4980, ARCH-4990, ARCH-6620, ARCH-6940, ARCH-6963, ARCH-6990, ARCH-9990, CIVL-4961"
Steven M Bedford,"ARCH-2110, ARCH-4640, ARCH-4650, ARCH-6610, ARCH-6700, ARCH-6710, ARCH-6720, IHSS-1970"
Joseph K. Ting,"ARCH-4750, ARCH-6940, MANE-4760"
Sidney P Fleisher,"ARCH-4760, ARCH-4940, ARCH-4963, ARCH-4964"
Alan Balfour,"ARCH-2130, ARCH-4040, ARCH-4940, ARCH-4980, ARCH-4990, ARCH-6680, ARCH-6941, ARCH-6961, ARCH-6990"
David Michael Bell,"ARCH-4940, ARCH-4980, ARCH-4990, ARCH-6940, ARCH-6990"
Kenneth Warriner,"ARCH-2130, ARCH-2200, ARCH-2210, ARCH-2220, ARCH-2510, ARCH-2600, ARCH-2610, ARCH-2940, ARCH-2961, ARCH-4040, ARCH-4240, ARCH-4250, ARCH-4260, ARCH-4270, ARCH-4360, ARCH-4940, ARCH-4962, ARCH-4965, ARCH-4966, ARCH-4973, ARCH-4980, ARCH-4990, ARCH-6120, ARCH-6130, ARCH-6400, ARCH-6940, ARCH-6980, ARCH-6990"
Donald Watson,"ARCH-4961, IENV-4961, IHSS-4961"
John Christopher Jaffe,"ARCH-4962, ARCH-6900, ARCH-6940, ARCH-6990"
Craig M Schwitter,"ARCH-4961, ARCH-4963, ARCH-4967, CIVL-4940, CIVL-4961, CIVL-4967"
Joseph Butler Macdonald,"ARCH-4940, ARCH-4980, ARCH-4990"
Anna Dyson,"ARCH-1961, ARCH-2360, ARCH-4160, ARCH-4240, ARCH-4250, ARCH-4260, ARCH-4270, ARCH-4360, ARCH-4810, ARCH-4932, ARCH-4940, ARCH-4961, ARCH-4963, ARCH-4964, ARCH-4966, ARCH-4980, ARCH-4990, ARCH-6120, ARCH-6130, ARCH-6310, ARCH-6320, ARCH-6330, ARCH-6350, ARCH-6360, ARCH-6420, ARCH-6810, ARCH-6900, ARCH-6910, ARCH-6940, ARCH-6961, ARCH-6962, ARCH-6963, ARCH-6964, ARCH-6965, ARCH-6966, ARCH-6967, ARCH-6969, ARCH-6990, ARCH-9990"
Nicole F Pertuiset,"ARCH-2110, ARCH-2210, ARCH-2220, ARCH-2961, ARCH-4940, ARCH-4990, ARCH-6110, ARCH-6940, ARCH-6990"
Donald Friedman,"ARCH-4700, ARCH-6670"
Wesley H Haynes,"ARCH-6610, ARCH-6710, ARCH-6720"
John C Jaffe,ARCH-6961
David J. Riebe,"ARCH-1961, ARCH-2200, ARCH-2210, ARCH-2240, ARCH-2510, ARCH-2600, ARCH-2961, ARCH-4240, ARCH-4250, ARCH-4260, ARCH-4270, ARCH-4300, ARCH-4430, ARCH-4940, ARCH-4963, ARCH-4964, ARCH-4965, ARCH-4967, ARCH-4969, ARCH-4980, ARCH-4990, ARCH-6990"
Chris P. Csikszentmihalyi,"ARTS-1020, ARTS-2030, ARTS-2940, ARTS-4940, ARTS-6940, ARTS-6964, ARTS-6990"
Elizabeth Blum,"ARTS-1200, ARTS-1940, ARTS-2940, ARTS-2961, ARTS-4200, ARTS-4940, IHSS-1961, IHSS-1962"
David R. Gibson,"ARTS-1400, ARTS-2300, ARTS-2350, ARTS-2400, ARTS-2500, ARTS-2940, ARTS-2962, ARTS-2964, ARTS-2965, ARTS-2966, ARTS-4400, ARTS-4940"
Robert Jon Gluck,ARTS-2020
Kathleen Ruiz,"ARCH-4940, ARTS-1020, ARTS-2040, ARTS-4510, ARTS-4860, ARTS-4940, ARTS-4961, ARTS-4962, ARTS-4964, ARTS-4965, ARTS-4966, ARTS-4969, ARTS-4971, ARTS-6400, ARTS-6860, ARTS-6940, ARTS-6966, ARTS-6971, ARTS-6990, ARTS-9990, CSCI-4940, GSAS-4510, GSAS-4960, GSAS-4962, GSAS-6200, GSAS-6940, GSAS-6980, GSAS-9990"
Maryanne Staniszewski,"ARTS-2100, ARTS-2540, ARTS-2940, ARTS-2961, ARTS-2964, ARTS-4100, ARTS-4940, ARTS-4965, ARTS-4973, ARTS-6080, ARTS-6110, ARTS-6120, ARTS-6570, ARTS-6900, ARTS-6940, ARTS-6961, ARTS-6962, ARTS-6964, ARTS-6965, ARTS-6966, ARTS-6967, ARTS-6973, ARTS-6990, ARTS-9990, IHSS-1300, IHSS-1961, IHSS-1962, IHSS-1965, IHSS-1973, INQR-1300, INQR-1964, LITR-6961"
Steven L Marking,"ARTS-2310, ARTS-2962, ARTS-2963, ARTS-2964, ARTS-2966, ARTS-4940"
Igor Vamos,"ARTS-1010, ARTS-1030, ARTS-1962, ARTS-2010, ARTS-2210, ARTS-2940, ARTS-4080, ARTS-4210, ARTS-4230, ARTS-4560, ARTS-4940, ARTS-4960, ARTS-4963, ARTS-4964, ARTS-4965, ARTS-4967, ARTS-4968, ARTS-4972, ARTS-4974, ARTS-6080, ARTS-6230, ARTS-6560, ARTS-6900, ARTS-6940, ARTS-6962, ARTS-6963, ARTS-6964, ARTS-6965, ARTS-6967, ARTS-6974, ARTS-6990, ARTS-9990, ITWS-2961, MATH-6970"
Milo Lazarevic,"ARTS-2210, ARTS-2530, ARTS-2560, ARTS-2940, ARTS-2961, ARTS-2962, ARTS-2963, ARTS-4940, ARTS-6940"
Paulina Shur,"ARTS-2560, ARTS-2600, ARTS-2940, ARTS-2961, ARTS-2962, ARTS-2963, ARTS-4620, ARTS-4940, ARTS-4962, IHSS-4940, LITR-2420"
Ralph A Pascucci,"ARTS-2961, ARTS-2965, ARTS-4940, ARTS-4965, ARTS-4977"
Caren Canier,"ARCH-4940, ARTS-1200, ARTS-2220, ARTS-2300, ARTS-2940, ARTS-2962, ARTS-2963, ARTS-2964, ARTS-4200, ARTS-4220, ARTS-4260, ARTS-4940, ARTS-4964, ARTS-4971, ARTS-6220, ARTS-6260, ARTS-6940, IHSS-1968"
Curtis Bahn,"ARCH-6990, ARTS-1010, ARTS-2020, ARTS-2965, ARTS-4010, ARTS-4030, ARTS-4050, ARTS-4160, ARTS-4410, ARTS-4940, ARTS-4961, ARTS-4962, ARTS-4963, ARTS-4964, ARTS-4967, ARTS-4974, ARTS-6030, ARTS-6080, ARTS-6160, ARTS-6410, ARTS-6900, ARTS-6940, ARTS-6961, ARTS-6962, ARTS-6963, ARTS-6964, ARTS-6965, ARTS-6966, ARTS-6967, ARTS-6990, ARTS-9990, IHSS-1010, IHSS-1961, IHSS-1962, IHSS-6570, ITEC-2961, ITEC-4961, ITWS-2961, ITWS-4961"
Leonardo P Quiles,"ARTS-4060, ARTS-4940"
Damijan F Saccio,"ARTS-4060, ARTS-4070, ARTS-4940, ARTS-4963"
Scott P Sindorf,"ARTS-4060, ARTS-4070, ARTS-4940, ARTS-4963, ARTS-6940"
Kathy Huffman,"ARTS-4100, ARTS-4940, STSS-2940"
Branda Miller,"ARTS-1030, ARTS-2010, ARTS-4040, ARTS-4050, ARTS-4080, ARTS-4100, ARTS-4250, ARTS-4840, ARTS-4850, ARTS-4910, ARTS-4940, ARTS-4961, ARTS-4962, ARTS-4963, ARTS-4966, ARTS-4970, ARTS-4990, ARTS-6040, ARTS-6050, ARTS-6080, ARTS-6090, ARTS-6250, ARTS-6900, ARTS-6940, ARTS-6961, ARTS-6962, ARTS-6963, ARTS-6964, ARTS-6966, ARTS-6990, ARTS-9990, COMM-4340, COMM-4350, COMM-4910, IHSS-1040, IHSS-1963, IHSS-1964, INQR-1040, ITEC-2961"
Eileen A O'Connor,"ARTS-4940, ISCI-4110"
Kathleen Brandt,"ARTS-2040, ARTS-4910, ARTS-4940, ARTS-4961, ARTS-4966, ARTS-6940, COMM-4910"
Larry Kagan,"ARTS-1200, ARTS-2210, ARTS-2940, ARTS-4210, ARTS-4940, ARTS-4965, ARTS-6940, ARTS-6990, ENGR-4961, IHSS-1960, IHSS-1961, IHSS-1965, ITEC-4962"
Stephen Charles Pierce,"ARTS-4120, ARTS-4964, ARTS-4966, IHSS-1220, ITWS-1220, STSH-4210, STSH-4230, STSH-4800, STSS-4360, STSS-4800, STSS-4840"
Jane F Koretz,"ARTS-6990, BCBP-2900, BCBP-2990, BCBP-4210, BCBP-4640, BCBP-4770, BCBP-4940, BCBP-4961, BCBP-6210, BCBP-6540, BCBP-6640, BCBP-6940, BCBP-6961, BCBP-6962, BCBP-6990, BIOL-4270, BIOL-4290, BIOL-4550, BIOL-4640, BIOL-4770, BIOL-4964, BIOL-6420, BIOL-6540, BIOL-6640, BIOL-6940, BIOL-6961, BIOL-6962, BIOL-6964, BIOL-6965, BIOL-6967, BIOL-6968, BIOL-6990, BIOL-9990, BMED-6964, CHEM-4770"
Neil B Rolnick,"ARTS-1010, ARTS-2020, ARTS-4100, ARTS-4940, ARTS-4961, ARTS-4964, ARTS-4965, ARTS-4967, ARTS-6080, ARTS-6900, ARTS-6940, ARTS-6961, ARTS-6963, ARTS-6964, ARTS-6966, ARTS-6968, ARTS-6990, COMM-9990, ITEC-2961, ITEC-4962"
Douglas CB Whittet,"ASTR-1530, ASTR-2120, ASTR-2940, ASTR-4120, ASTR-4510, ASTR-4900, ASTR-4940, ASTR-4960, ASTR-6250, ASTR-6900, ASTR-6940, ASTR-6960, ASTR-9990, ERTH-2940, ERTH-6940, ISCI-4500, ISCI-4510, ISCI-4940, ISCI-9990, PHYS-6970, PHYS-6980, PHYS-9990"
Heidi Jo Newberg,"ASTR-1510, ASTR-1520, ASTR-1940, ASTR-2050, ASTR-2120, ASTR-2940, ASTR-2941, ASTR-2960, ASTR-2962, ASTR-4120, ASTR-4900, ASTR-4940, ASTR-4941, ASTR-4960, ASTR-4961, ASTR-6900, ASTR-6940, ASTR-6960, ASTR-6970, ASTR-9990, PHYS-1200, PHYS-1940, PHYS-2940, PHYS-2941, PHYS-2950, PHYS-2962, PHYS-2990, PHYS-4940, PHYS-4941, PHYS-4960, PHYS-4961, PHYS-4962, PHYS-6940, PHYS-6960, PHYS-6961, PHYS-6970, PHYS-6980, PHYS-6990, PHYS-9990"
Wayne G Roberge,"ASTR-1510, ASTR-2940, ASTR-4220, ASTR-4240, ASTR-4900, ASTR-4940, ASTR-6900, ASTR-6940, ASTR-6960, ASTR-6970, ASTR-9990, BCBP-2900, ISCI-4510, PHYS-1200, PHYS-2210, PHYS-2510, PHYS-2940, PHYS-4240, PHYS-4420, PHYS-4810, PHYS-4940, PHYS-4961, PHYS-6410, PHYS-6900, PHYS-6962, PHYS-6980, PHYS-6990, PHYS-9990"
James Anthony Napolitano,"ASTR-4940, PHYS-4940"
Joyce J Diwan,"BCBP-2900, BCBP-2930, BCBP-2940, BCBP-2950, BCBP-4760, BCBP-4770, BCBP-4940, BCBP-4990, BIOL-2930, BIOL-4260, BIOL-4760, BIOL-4770, BIOL-6900, BIOL-6940, CHEM-4760, CHEM-4770, CHEM-6940, ISCI-6230"
Jackie Lynne Collier,"BCBP-2940, BCBP-4710, BCBP-4940, BIOL-2900, BIOL-2940, BIOL-2990, BIOL-4620, BIOL-4710, BIOL-4940, BIOL-6940, BIOL-6963, BIOL-6964, BIOL-6990, BIOL-9990, ENVE-6940, IENV-6940, ISCI-6240"
Harry Roy,"BCBP-2930, BCBP-4310, BCBP-4710, BCBP-6310, BIOL-1010, BIOL-2410, BIOL-2500, BIOL-4080, BIOL-4710, BIOL-4860, BIOL-4940, BIOL-4962, BIOL-6002, BIOL-6720, BIOL-9990"
John C. Salerno,"BCBP-2900, BCBP-4710, BCBP-4810, BCBP-4940, BCBP-6810, BCBP-6940, BIOL-2940, BIOL-4540, BIOL-4550, BIOL-4710, BIOL-4940, BIOL-6410, BIOL-6940, BIOL-6962, BIOL-6990, BIOL-9990, ITEC-6980"
Wilfredo Colon,"BCBP-2930, BCBP-2940, BCBP-2950, BCBP-4210, BCBP-4760, BCBP-4780, BCBP-4940, BCBP-4980, BCBP-4990, BCBP-6210, BCBP-6780, BCBP-6940, BCBP-6970, BCBP-6990, BCBP-9990, BIOL-2900, BIOL-4760, BIOL-4990, CHEM-1100, CHEM-1110, CHEM-1900, CHEM-1960, CHEM-2940, CHEM-2941, CHEM-2950, CHEM-4440, CHEM-4760, CHEM-4780, CHEM-4900, CHEM-4940, CHEM-4941, CHEM-4950, CHEM-4960, CHEM-4961, CHEM-4962, CHEM-4990, CHEM-6780, CHEM-6900, CHEM-6940, CHEM-6961, CHEM-6962, CHEM-6965, CHEM-6970, CHEM-6990, CHEM-9990, CHME-2980, CHME-6990, CHME-9990, ISCI-6980"
Ivar Giaever,"BCBP-4990, BCBP-6990, BIOL-2990, BIOL-4940, BIOL-6940, PHYS-2962, PHYS-4940, PHYS-4961, PHYS-6940, PHYS-9990"
Michael H Hanna,"BCBP-2900, BIOL-0060, BIOL-1010, BIOL-1015, BIOL-1020, BIOL-1960, BIOL-2120, BIOL-2310, BIOL-2410, BIOL-2900, BIOL-2930, BIOL-2940, BIOL-2980, BIOL-2990, BIOL-4080, BIOL-4090, BIOL-4110, BIOL-4120, BIOL-4620, BIOL-4930, BIOL-4940, BIOL-4962, BIOL-4963, BIOL-4980, BIOL-6690, BIOL-6940, BIOL-6990, BIOL-9990, BMED-4110, BMED-4120, BMED-4130, CHEM-4940, ISCI-6210, ISCI-6240, ITEC-4940"
Charles W Boylen,"BCBP-4990, BIOL-1010, BIOL-2310, BIOL-2900, BIOL-2930, BIOL-2940, BIOL-4070, BIOL-4370, BIOL-4400, BIOL-4700, BIOL-4850, BIOL-4940, BIOL-4961, BIOL-4963, BIOL-4970, BIOL-4990, BIOL-6310, BIOL-6330, BIOL-6940, BIOL-6961, BIOL-6970, BIOL-6990, BIOL-9990, ENVE-6970, ENVE-6990, ISCI-6960"
Robert H Parsons,"BIOL-1010, BIOL-1020, BIOL-2900, BIOL-2930, BIOL-2940, BIOL-2990, BIOL-4280, BIOL-4290, BIOL-4940, BIOL-6940, BIOL-6965, BIOL-6966, BIOL-6967, BIOL-6968, BIOL-6990, BIOL-9990, ISCI-4120, ISCI-6210, ISCI-6960"
George F Edick,"BCBP-4940, BCBP-4990, BIOL-1020, BIOL-2120, BIOL-2900, BIOL-2940, BIOL-2990, BIOL-4020, BIOL-4050, BIOL-4060, BIOL-4330, BIOL-4740, BIOL-4940, BIOL-4961, BIOL-4963, BIOL-4965, BIOL-6330, BIOL-6940, BIOL-6961, BIOL-6963"
Sandra Nierzwicki-Bauer,"BIOL-1010, BIOL-2900, BIOL-2940, BIOL-2960, BIOL-2990, BIOL-4680, BIOL-4870, BIOL-4940, BIOL-4960, BIOL-4961, BIOL-4970, BIOL-6360, BIOL-6510, BIOL-6520, BIOL-6680, BIOL-6940, BIOL-6963, BIOL-6970, BIOL-6990, BIOL-9990, CHEM-4950, ERTH-9990, ISCI-6960"
Charles J Pfau,"BIOL-4360, BIOL-4410, BIOL-4420, BIOL-4940"
Christopher Bystroff,"BCBP-4210, BCBP-4310, BCBP-4550, BCBP-4870, BCBP-4940, BCBP-4961, BCBP-4990, BCBP-6210, BCBP-6310, BCBP-6420, BCBP-6870, BCBP-6961, BCBP-6970, BCBP-9990, BIOL-4520, BIOL-4540, BIOL-4550, BIOL-4940, BIOL-4941, BIOL-4961, BIOL-4970, BIOL-4990, BIOL-6410, BIOL-6420, BIOL-6510, BIOL-6900, BIOL-6940, BIOL-6961, BIOL-6962, BIOL-6963, BIOL-6970, BIOL-6990, BIOL-9990, CSCI-6980, CSCI-6990, CSCI-9990, DSES-6940, ITEC-6980"
Susan M Smith,"BIOL-2930, BIOL-4540, BIOL-4550, BIOL-4620, BIOL-4630, BIOL-4720, BIOL-4940, BIOL-6420, BIOL-6690, BIOL-6940, BIOL-6961, BIOL-6962, BIOL-6963, BIOL-6980, BIOL-6990, BIOL-9990, BMED-6970"
Donna Eisemann Crone,"BCBP-4310, BCBP-4640, BCBP-4990, BCBP-6310, BCBP-6640, BCBP-6990, BIOL-2120, BIOL-2940, BIOL-2990, BIOL-4350, BIOL-4620, BIOL-4630, BIOL-4640, BIOL-4720, BIOL-4740, BIOL-4940, BIOL-4970, BIOL-4990, BIOL-6350, BIOL-6640, BIOL-6690, BIOL-6961, BIOL-6963, ISCI-6240"
Jonathan Zehr,BIOL-4940
Jonathan C Newell,"BMED-1340, BMED-2200, BMED-2940, BMED-4010, BMED-4940, BMED-6940, BMED-6962, BMED-6980, BMED-6990, BMED-9990, ECSE-4940, ENGR-1330, ENGR-1960, ENGR-2050"
Meredith Elaine Hasenbein,BMED-2940
Rena Bizios,"BMED-2940, BMED-2950, BMED-4240, BMED-4940, BMED-6240, BMED-6940, BMED-6990, BMED-9990, ENGR-2250, PHYS-2940"
Lee E Ostrander,"BMED-4470, BMED-4490, BMED-4600, BMED-4940, BMED-6940, BMED-6980, BMED-6990, ENGR-2350"
Robert L Spilker,"BMED-2200, BMED-4500, BMED-4540, BMED-4940, BMED-6990, BMED-9990, CIVL-4240, ENGR-1100, MANE-4240, MANE-6990, MANE-9990"
Allen Zelman,"BMED-4940, BMED-4961, BMED-6940"
Deepak Vashishth,"BCBP-9990, BIOL-6550, BIOL-6966, BMED-2540, BMED-2940, BMED-2941, BMED-2950, BMED-4500, BMED-4510, BMED-4540, BMED-4940, BMED-4941, BMED-4960, BMED-4961, BMED-4962, BMED-6500, BMED-6510, BMED-6700, BMED-6940, BMED-6961, BMED-6963, BMED-6964, BMED-6966, BMED-6967, BMED-6980, BMED-6990, BMED-9990, CHEM-6963, CHEM-6966, CHME-6966, ENGR-6960, LGHT-6966"
John Beyer Brunski,"BMED-2100, BMED-2940, BMED-2961, BMED-4600, BMED-4940, BMED-4962, BMED-6280, BMED-6290, BMED-6940, BMED-6990, BMED-9990, ENGR-1100, MANE-6990, MANE-9990"
Daniel Walczyk,"BMED-6940, BMED-6980, DSES-6961, ENGR-2020, ENGR-2050, ENGR-2940, ENGR-4710, ENGR-4720, ENGR-6120, ENGR-6960, MANE-2940, MANE-2941, MANE-4260, MANE-4550, MANE-4940, MANE-4941, MANE-4961, MANE-6110, MANE-6230, MANE-6800, MANE-6961, MANE-6962, MANE-6963, MANE-6964, MANE-6965, MANE-6967, MANE-6969, MANE-6980, MANE-6990, MANE-9990, MTLE-6965"
Badrinath Roysam,"BMED-4800, BMED-4962, BMED-6940, BMED-6961, BMED-6965, BMED-6980, BMED-6990, BMED-9990, CSCI-6990, CSCI-9990, ECSE-2610, ECSE-2660, ECSE-4800, ECSE-4940, ECSE-4962, ECSE-4963, ECSE-4968, ECSE-4980, ECSE-6940, ECSE-6963, ECSE-6970, ECSE-6980, ECSE-6990, ECSE-9990"
Linda T. McCloskey,"ADMN-4050, CHME-2020, CIVL-2940, ENGR-1010, ENGR-2050, ENGR-2940, ENGR-4010, MGMT-1240, MGMT-1250, MGMT-1940, MGMT-7230"
Michael M Abbott,"CHME-2010, CHME-2020, CHME-2940, CHME-4050, CHME-4180, CHME-4940, CHME-6570, CHME-6990"
Joel Plawsky,"CHME-1010, CHME-2100, CHME-2940, CHME-4010, CHME-4020, CHME-4100, CHME-4150, CHME-4160, CHME-4940, CHME-4963, CHME-4964, CHME-4966, CHME-4968, CHME-6510, CHME-6520, CHME-6640, CHME-6900, CHME-6940, CHME-6962, CHME-6963, CHME-6965, CHME-6966, CHME-6968, CHME-6990, CHME-9990, ENGR-2250, ENVE-4160, MTLE-9990"
B Wayne Bequette,"CHEM-4940, CHME-1010, CHME-2050, CHME-4030, CHME-4050, CHME-4060, CHME-4500, CHME-4660, CHME-4940, CHME-4961, CHME-4962, CHME-4963, CHME-4964, CHME-4965, CHME-4967, CHME-6650, CHME-6660, CHME-6940, CHME-6961, CHME-6962, CHME-6963, CHME-6966, CHME-6990, CHME-9990, DSES-4961, MANE-4961, MTLE-4961"
Steven Cramer,"BCBP-6963, BCBP-9990, BMED-4960, BMED-6960, BMED-6964, CHEM-6964, CHEM-9990, CHME-2980, CHME-4040, CHME-4400, CHME-4940, CHME-4941, CHME-6440, CHME-6940, CHME-6961, CHME-6962, CHME-6967, CHME-6980, CHME-6990, CHME-9990, MGMT-6980"
Bruce Nauman,"CHEM-9990, CHME-1960, CHME-2980, CHME-4500, CHME-4940, CHME-4963, CHME-6640, CHME-6962, CHME-6963, CHME-6990, CHME-9990"
Jonathan Dordick,"BCBP-4990, BCBP-9990, BIOL-4963, BIOL-6961, BIOL-6965, BIOL-6969, BIOL-6990, BIOL-9990, BMED-4969, BMED-6962, BMED-6966, BMED-6968, BMED-9990, CHEM-4964, CHEM-6964, CHEM-6966, CHME-2010, CHME-2020, CHME-2940, CHME-2941, CHME-4170, CHME-4430, CHME-4940, CHME-4941, CHME-4961, CHME-4967, CHME-6430, CHME-6940, CHME-6961, CHME-6963, CHME-6964, CHME-6966, CHME-6967, CHME-6969, CHME-6990, CHME-9990"
Georges Belfort,"BCBP-9990, BIOL-6940, CHEM-2940, CHME-2940, CHME-2950, CHME-4940, CHME-4961, CHME-4962, CHME-4963, CHME-4964, CHME-4968, CHME-6410, CHME-6420, CHME-6470, CHME-6510, CHME-6940, CHME-6960, CHME-6961, CHME-6962, CHME-6964, CHME-6968, CHME-6970, CHME-6990, CHME-9990"
Timothy Cale,"CHEM-6940, CHME-4600, CHME-6940, CHME-6961, CHME-6964, CHME-6990, CHME-9990"
